{
  "schemaVersion": "1.0",
  "build": {
    "commitSha": "8aed9aa927ea864465a307fb50493d5ccfe4e1a6",
    "pluginVersion": "0.8.52",
    "packageSha256": "e2eb69a04a2a8b0126d428640bdd344a2bb16a37919fa511412209588c765408"
  },
  "environment": {
    "stagingUrl": "https://test2.hangar18.dk",
    "browser": "PENDING",
    "os": "PENDING",
    "desktopViewport": "PENDING",
    "tabletViewport": "PENDING",
    "mobileViewport": "PENDING"
  },
  "scenarios": {
    "A": {"status": "PENDING", "evidence": [], "note": "Elementbibliotek og drag/drop: Kasse, Række-/kolonne-kasse, Række- og kolonne-kasse og Auto-kasser skal fortsat fungere med dansk terminologi uden synlig legacy Auto-kasse prompt."},
    "B": {"status": "PENDING", "evidence": [], "note": "Kasse/nesting: eksisterende container/flex/grid, LayoutParentKey og nested Over/Under fra v0.8.51 skal være uændret efter LEGO-052 hotfixen."},
    "C": {"status": "FAIL", "evidence": ["Manual test 2026-08-23: Tekst + Billede blev placeret i Række- og kolonne-kasse; endnu et Billede blev droppet Under det første billede. Resultatet blev tre 4/12 sibling-kolonner i stedet for at det nye billede blev stablet lodret under det første i samme kolonne."], "note": "2D nested stack FAIL: LayoutParentKey ser ud til at blive sat til samme grid-parent, men det nye barns stack-state/StackRootKey bliver ikke etableret, så grid'et fordeler alle tre børn som almindelige kolonner. Selection-loop hotfixen testes separat."},
    "D": {"status": "PENDING", "evidence": [], "note": "Resize: lodret kolonne-resize og vandret 2D højderesize fra v0.8.51 skal fortsat fungere uden at selection eller nested layout går tabt."},
    "E": {"status": "PENDING", "evidence": [], "note": "Responsive Desktop/Mobil-værdier og arv skal være uændrede; LEGO-052 må ikke mutere gemte frontend-layoutværdier."},
    "F": {"status": "PENDING", "evidence": [], "note": "Inspector-selection: valgt element skal få og beholde den komplette røde markering, også efter skift mellem nested tekst/billede og efter Inspector-handoff."},
    "G": {"status": "PENDING", "evidence": [], "note": "Inspector/workspace: Luft, baggrund og placering skal vises i én full-width Desktop/Mobil-shell med læsbare labels og inputfelter; den gamle smalle fler-kolonne-visning må ikke genopstå."},
    "H": {"status": "PENDING", "evidence": [], "note": "Undo/Redo og historik skal være uændret; selection alene må ikke oprette historiktrin, og tidligere v0.8.51 nested/drop/resize-historik skal bestå."},
    "I": {"status": "PENDING", "evidence": [], "note": "Save/reload persistence: eksisterende 2D stack/højdefordeling, side-, Kasse- og layoutdata skal overleve gem/genindlæs uden schemaændring."},
    "J": {"status": "PENDING", "evidence": [], "note": "Ugemt forhåndsvisning Desktop/Tablet/Mobil skal ligne frontend og må ikke påvirkes af Inspector hotfixen eller vise editor-chrome."},
    "K": {"status": "PENDING", "evidence": [], "note": "Backup/restore sanity og eksisterende page backup/restore flows skal være uændret af LEGO-052."},
    "L": {"status": "PENDING", "evidence": [], "note": "Vehicle/Event/Gallery og allerede designede sider skal være visuelt og funktionelt uændrede; public cutover må ikke aktiveres af denne release."}
  },
  "criticalFlags": {
    "consoleError": false,
    "dataLossOrDuplicate": false,
    "protectedDomainRegression": false
  },
  "overallStatus": "FAIL",
  "notes": "v0.8.52 automated QA passed on the LEGO-052 candidate, but manual test2 acceptance found a 2D nested stack regression: dropping a new image Under an existing image inside the same grid created a third sibling column rather than a vertical stack. Scenario C is therefore FAIL and public cutover remains unauthorized."
}
