{
  "schemaVersion": "1.0",
  "build": {
    "commitSha": "200a718c951dce92fd5719040b203d49f75c8ec3",
    "pluginVersion": "0.8.46",
    "packageSha256": "4ad1db45ee236edf338e9b49c33f510f92607e11dbef8df890bc7601e329d8a6"
  },
  "environment": {
    "stagingUrl": "https://test2.hangar18.dk",
    "browser": "PENDING",
    "os": "PENDING",
    "desktopViewport": "PENDING",
    "tabletViewport": "PENDING",
    "mobileViewport": "PENDING"
  },
  "scenarios": {
    "A": {"status": "PENDING", "evidence": [], "note": "Elementbibliotek og drop; Over/Under skal lande på korrekt side af målgruppen"},
    "B": {"status": "PENDING", "evidence": [], "note": "Kasse og nesting"},
    "C": {"status": "PENDING", "evidence": [], "note": "Side-by-side / Auto-kasser; 2 børn skal vises korrekt straks"},
    "D": {"status": "PENDING", "evidence": [], "note": "Desktop resize"},
    "E": {"status": "PENDING", "evidence": [], "note": "Tablet/Mobil overrides + Arv Desktop"},
    "F": {"status": "PENDING", "evidence": [], "note": "Design og spacing"},
    "G": {"status": "PENDING", "evidence": [], "note": "Foldbare paneler"},
    "H": {"status": "PENDING", "evidence": [], "note": "Undo/Redo; første Fortryd efter et nyt Under-drop må kun fjerne den seneste handling"},
    "I": {"status": "PENDING", "evidence": [], "note": "Save/reload persistence"},
    "J": {"status": "PENDING", "evidence": [], "note": "Preview Desktop/Tablet/Mobil"},
    "K": {"status": "PENDING", "evidence": [], "note": "Backup/restore, inkl. PAGE-DELETE safety-backup restore sanity"},
    "L": {"status": "PENDING", "evidence": [], "note": "Vehicle/Event/Gallery regression"}
  },
  "criticalFlags": {
    "consoleError": false,
    "dataLossOrDuplicate": false,
    "protectedDomainRegression": false
  },
  "overallStatus": "PENDING",
  "notes": "Canonical pre-manual acceptance record for official Hangar18 Manager v0.8.46. LEGO-046 targets two v0.8.45 findings: palette Under inserted above the target group, and rapid consecutive palette gestures could merge into one Undo checkpoint. Manual retest must confirm correct Under placement and that one Fortryd removes only the latest drop. No manual PASS is claimed. Public cutover is not authorized."
}
