{
  "schemaVersion": "1.0",
  "build": {
    "commitSha": "8ba2c408654a40df9a8010fe3b919cbce29e2efd",
    "pluginVersion": "0.8.54",
    "packageSha256": "72f8eedc92d44f8ccd29d42d859391826d3ae07affb0d84d905bee83563d2d2c"
  },
  "environment": {
    "stagingUrl": "https://test2.hangar18.dk",
    "browser": "PENDING",
    "os": "PENDING",
    "desktopViewport": "PENDING",
    "tabletViewport": "PENDING",
    "mobileViewport": "PENDING"
  },
  "scenarios": {
    "A": {"status": "FAIL", "evidence": ["manual-2026-08-23-two-screenshots"], "note": "FAIL: real v0.8.54 editor still shows the legacy field/text 'Træk en Kasse ind i Auto-kasser.' below the nested Grid after normal load/repaint. The v0.8.54 hide rule/test did not match the real DOM lifecycle."},
    "B": {"status": "PENDING", "evidence": [], "note": "Kasse/nesting: eksisterende container/flex/grid, LayoutParentKey og StackRootKey-data skal bevares."},
    "C": {"status": "FAIL", "evidence": ["manual-2026-08-23-two-screenshots"], "note": "FAIL: starting from a 6/12 + 6/12 Image/Heading layout, dropping a new element Under does not create a vertical stack. The real editor ends with three 4/12 siblings, proving nested adoption/StackRootKey was not established."},
    "D": {"status": "PENDING", "evidence": [], "note": "Resize: lodret kolonne-resize og vandret højderesize mellem stablede elementer skal fortsat fungere og holde gyldige fordelinger."},
    "E": {"status": "PENDING", "evidence": [], "note": "Responsive Desktop/Mobil-værdier, arv og gemte frontend-layoutværdier skal være uændrede af hotfixen."},
    "F": {"status": "PENDING", "evidence": ["manual-2026-08-23-two-screenshots"], "note": "Selection-markeringen er synlig i det modtagne screenshot, men komplet fire-sidet acceptance er endnu ikke registreret som PASS."},
    "G": {"status": "PENDING", "evidence": [], "note": "Inspector: det tidligere godkendte full-width Desktop/Mobil-layout for 'Luft, baggrund og placering' skal være uændret og læsbart."},
    "H": {"status": "PENDING", "evidence": [], "note": "Undo/Redo: nested stack/drop skal være logiske enkelttrin, selection alene må ikke oprette historiktrin, og eksisterende image/text history skal fortsat virke."},
    "I": {"status": "PENDING", "evidence": [], "note": "Save/reload persistence: LayoutParentKey, StackRootKey, højdefordeling og eksisterende side-/Kasse-data skal overleve gem og genindlæs uden schemaændring."},
    "J": {"status": "PENDING", "evidence": [], "note": "Updater + preview: updater-state-fix og ugemt preview er ikke manuelt accepteret i denne testsekvens."},
    "K": {"status": "PENDING", "evidence": [], "note": "Backup/restore sanity: B1 page backup/restore og B2 site backup flows skal være uændrede."},
    "L": {"status": "PENDING", "evidence": [], "note": "Vehicle/Event/Gallery og allerede designede sider skal være visuelt og funktionelt uændrede. Public cutover må ikke aktiveres."}
  },
  "criticalFlags": {
    "consoleError": false,
    "dataLossOrDuplicate": false,
    "protectedDomainRegression": false
  },
  "overallStatus": "FAIL",
  "notes": "Manual v0.8.54 staging evidence shows two blocking regressions: the legacy Auto-kasse prompt remains visible in the real editor, and palette Under still falls back to a third 4/12 Grid sibling rather than establishing the intended vertical stack. Automated v0.8.54 coverage was therefore insufficiently live-like and must be replaced/extended before the next test package. Public cutover remains unauthorized."
}
