{
  "schemaVersion": "1.0",
  "build": {
    "commitSha": "8c18cfa06c36f7bbef633ad23655ab7ca87a62da",
    "pluginVersion": "0.8.51",
    "packageSha256": "d62b1e403e3f7691533eb46551ab1e433024e7becd369de23bca8021bf000077"
  },
  "environment": {
    "stagingUrl": "https://test2.hangar18.dk",
    "browser": "PENDING",
    "os": "PENDING",
    "desktopViewport": "PENDING",
    "tabletViewport": "PENDING",
    "mobileViewport": "PENDING"
  },
  "scenarios": {
    "A": {"status": "PENDING", "evidence": [], "note": "Elementbibliotek og drag/drop: Kasse, Række-/kolonne-kasse, Række- og kolonne-kasse og Auto-kasser skal fungere med dansk terminologi; gammel synlig Auto-kasse prompt må ikke genopstå."},
    "B": {"status": "PENDING", "evidence": [], "note": "Kasse/nesting: eksisterende container/flex/grid og LayoutParentKey-data skal bevares, og nested Over/Under skal blive i den relevante Række- og kolonne-kasse."},
    "C": {"status": "PENDING", "evidence": [], "note": "Side-by-side og 2D layout: børn skal vises straks, kunne stables lodret i samme kolonne og ikke duplikeres som topniveau-elementer."},
    "D": {"status": "PENDING", "evidence": [], "note": "Resize: eksisterende lodret splitter skal fortsat styre kolonnebredde, mens ny vandret splitter mellem stablede elementer skal styre højdefordeling uden at miste børn eller selection."},
    "E": {"status": "PENDING", "evidence": [], "note": "Responsive Desktop/Mobil-værdier og arv: Inspector-faner og editorens responsive UI må ikke ændre gemte frontend-layoutværdier utilsigtet."},
    "F": {"status": "PENDING", "evidence": [], "note": "Inspector/Kasse-design: valgt element skal have komplet rød markering på alle fire sider; baggrund, kant og radius skal ramme hele den ydre Kasse, og Custom baggrund skal kunne vælges direkte."},
    "G": {"status": "PENDING", "evidence": [], "note": "Inspector/workspace: Luft, baggrund og placering skal have læsbare Desktop/Mobil-faner, bredere felter og fungere på laptop såvel som stor skærm."},
    "H": {"status": "PENDING", "evidence": [], "note": "Undo/Redo: billede, tekst, nested drop og 2D højderesize skal give korrekte separate historiktrin uden at selection alene opretter et ekstra trin."},
    "I": {"status": "PENDING", "evidence": [], "note": "Save/reload persistence: 2D stack/højdefordeling samt eksisterende side-, Kasse- og layoutdata skal overleve gem/genindlæs uden schemaregression."},
    "J": {"status": "PENDING", "evidence": [], "note": "Ugemt forhåndsvisning Desktop/Tablet/Mobil skal ligne frontend og må ikke vise editor-chrome, legacy Auto-kasse prompt eller duplikerede nested elementer."},
    "K": {"status": "PENDING", "evidence": [], "note": "Backup/restore sanity, inklusive eksisterende page backup/restore og safety-backup flows, skal være uændret af LEGO-051."},
    "L": {"status": "PENDING", "evidence": [], "note": "Vehicle/Event/Gallery og allerede designede sider skal være visuelt og funktionelt uændrede; public cutover må ikke aktiveres af denne release."}
  },
  "criticalFlags": {
    "consoleError": false,
    "dataLossOrDuplicate": false,
    "protectedDomainRegression": false
  },
  "overallStatus": "PENDING",
  "notes": "v0.8.51 official test package is built after automated Architecture QA, LEGO Editor QA and I9 Prep QA passed on the release candidate. All v0.8.51 manual A-L scenarios intentionally start PENDING; no v0.8.50 manual PASS/FAIL is carried forward as v0.8.51 evidence. Public cutover remains unauthorized."
}
