{
  "schemaVersion": "1.0",
  "build": {
    "commitSha": "937f0816065f0638ca5a43b55966f6fa75bd48a1",
    "pluginVersion": "0.8.50",
    "packageSha256": "adff47f95ccf509d415ba8216fbbd2361f6814040345b56545770f2247ac54a4"
  },
  "environment": {
    "stagingUrl": "https://test2.hangar18.dk",
    "browser": "PENDING",
    "os": "PENDING",
    "desktopViewport": "PENDING",
    "tabletViewport": "PENDING",
    "mobileViewport": "PENDING"
  },
  "scenarios": {
    "A": {"status": "PENDING", "evidence": [], "note": "Elementbibliotek og drop; Kasse, Række-/kolonne-kasse, Række- og kolonne-kasse og Auto-kasser skal vises med dansk terminologi, og Over/Under skal lande korrekt."},
    "B": {"status": "PENDING", "evidence": [], "note": "Kasse og nesting; den gamle separate Container må ikke fremstå som dublet, mens eksisterende container-data fortsat skal virke."},
    "C": {"status": "PASS", "evidence": ["Manual test2 approval 2026-08-22: Test 1 image selection/live Inspector→canvas sync passed; Test 2 text/live Inspector→canvas sync passed without reselecting the element."], "note": "Side-by-side / Auto-kasser; nested text/image Inspector changes were manually confirmed to update canvas immediately without reselecting the element."},
    "D": {"status": "PENDING", "evidence": [], "note": "Desktop resize; resize-håndtag skal fortsat manipulere layout direkte uden at Kassen mister børn eller selection."},
    "E": {"status": "PENDING", "evidence": [], "note": "Tablet/Mobil overrides + Arv Desktop; editorens egen responsive UI må ikke ændre de gemte frontend-layoutværdier."},
    "F": {"status": "FAIL", "evidence": ["Manual test2 screenshot 2026-08-22: selected Billede element shows red selection overlay on top/left/bottom, but the right side is not visible before any design change.", "Manual test2 screenshot 2026-08-22: Test 5 Kasse-design fails; border/design is rendered around the text content itself instead of the entire outer 6/12 Kasse/grid cell. The text may auto-size internally, but background/border/radius must belong to the full outer Kasse."], "note": "Inspector/container design has two confirmed failures: the red selection overlay is clipped/missing on the right edge, and Kasse design is applied to the content layer instead of the full outer Kasse. Selection and background/border/radius must visually address the complete Kasse on all four sides while content may auto-size inside it."},
    "G": {"status": "PENDING", "evidence": [], "note": "Editor-workspace og foldbare paneler; UI skal være mere kompakt på laptop og udnytte store skærme via responsive kolonner, skrift, controls og spacing uden browser-zoom."},
    "H": {"status": "PASS", "evidence": ["Manual test2 approval 2026-08-22: Test 3 passed; after image selection and subsequent text insertion, first Undo removed only the text and retained the image."], "note": "Undo/Redo media history checkpoint manually confirmed: image selection is isolated from a later text insertion."},
    "I": {"status": "PENDING", "evidence": [], "note": "Save/reload persistence; interne container/flex/grid-typer og eksisterende gemte sider skal bevare struktur og design."},
    "J": {"status": "PENDING", "evidence": [], "note": "Preview Desktop/Tablet/Mobil; nested element må ikke duplikeres som topniveau, og gammel editor-chrome som 'Kasser i rækken' / 'Slip endnu en Kasse her' må ikke vises."},
    "K": {"status": "PENDING", "evidence": [], "note": "Backup/restore, inkl. PAGE-DELETE safety-backup restore sanity."},
    "L": {"status": "PENDING", "evidence": [], "note": "Vehicle/Event/Gallery samt allerede designede sider skal være visuelt og funktionelt uændrede af LEGO-050 og den responsive editor-UI."}
  },
  "criticalFlags": {
    "consoleError": false,
    "dataLossOrDuplicate": false,
    "protectedDomainRegression": false
  },
  "overallStatus": "FAIL",
  "notes": "Manual v0.8.50 testing has started on test2. Tests 1 and 2 (live image/text Inspector-to-canvas sync) and Test 3 (isolated image Undo history) are approved. Test 4 fails because the selected element's red overlay is missing/clipped on the right edge before any design change. Test 5 also fails because Kasse design is rendered around the content layer instead of the entire outer Kasse/grid cell. A separate editor defect is recorded in the working fix list: the old visible 'Træk en Kasse ind i Auto-kasser.' chrome can reappear when selecting a nested element; its drop hit target may remain functional but the legacy visible prompt must stay hidden. Public cutover remains unauthorized."
}