{
  "schemaVersion": "1.0",
  "build": {
    "commitSha": "5fcc55fe160d27919ab1a15ea9adffc0a62354d0",
    "pluginVersion": "0.8.48",
    "packageSha256": "84bdb2c883e50dc92395378e71882a2c2693abeaaaef03824b76d94f586e00a6"
  },
  "environment": {
    "stagingUrl": "https://test2.hangar18.dk",
    "browser": "PENDING",
    "os": "PENDING",
    "desktopViewport": "PENDING",
    "tabletViewport": "PENDING",
    "mobileViewport": "PENDING"
  },
  "scenarios": {
    "A": {"status": "PENDING", "evidence": [], "note": "Elementbibliotek og drop; Over/Under skal lande på korrekt side af målgruppen"},
    "B": {"status": "PENDING", "evidence": [], "note": "Kasse og nesting"},
    "C": {"status": "PENDING", "evidence": [], "note": "Side-by-side / Auto-kasser; børn skal vises korrekt straks, forblive synlige ved Inspector-selection og forblive intakte efter kolonne-resize"},
    "D": {"status": "PENDING", "evidence": [], "note": "Desktop resize; resize-håndtag/rails skal manipulere layout direkte uden at Grid/Auto-kasse mister børn"},
    "E": {"status": "PENDING", "evidence": [], "note": "Tablet/Mobil overrides + Arv Desktop"},
    "F": {"status": "PENDING", "evidence": [], "note": "Inspector-only elementredigering; valgt element skal markeres visuelt på canvas, Direkte design og gamle inline billed-/box-model-kontroller må ikke overtage canvas"},
    "G": {"status": "PENDING", "evidence": [], "note": "Foldbare paneler"},
    "H": {"status": "PENDING", "evidence": [], "note": "Undo/Redo; Inspector-selection må ikke oprette utilsigtede historiktrin"},
    "I": {"status": "PENDING", "evidence": [], "note": "Save/reload persistence"},
    "J": {"status": "PENDING", "evidence": [], "note": "Preview Desktop/Tablet/Mobil; nested element må ikke duplikeres som topniveau, og editor-only chrome skal være fjernet"},
    "K": {"status": "PENDING", "evidence": [], "note": "Backup/restore, inkl. PAGE-DELETE safety-backup restore sanity"},
    "L": {"status": "PENDING", "evidence": [], "note": "Vehicle/Event/Gallery regression"}
  },
  "criticalFlags": {
    "consoleError": false,
    "dataLossOrDuplicate": false,
    "protectedDomainRegression": false
  },
  "overallStatus": "PENDING",
  "notes": "Canonical pre-manual acceptance record for official Hangar18 Manager v0.8.48. LEGO-048 adds visible selection outline, removes legacy Direkte design/image/box-model canvas chrome, makes nested resize Inspector-aware and de-duplicates unsaved preview. Manual testing on test2 is still in progress and has not been claimed PASS. Public cutover is not authorized."
}
