{
  "schemaVersion": "1.0",
  "build": {
    "commitSha": "a3a3f38e168a77e8ebb641d1643e35930760d48a",
    "pluginVersion": "0.8.53",
    "packageSha256": "bdb2fa443841b7d861e237975653305d0a65cb13e3801ed0fd091de46d20074c"
  },
  "environment": {
    "stagingUrl": "https://test2.hangar18.dk",
    "browser": "PENDING",
    "os": "PENDING",
    "desktopViewport": "PENDING",
    "tabletViewport": "PENDING",
    "mobileViewport": "PENDING"
  },
  "scenarios": {
    "A": {"status": "FAIL", "evidence": ["manual-2026-08-23-screenshot"], "note": "FAIL: legacy prompt 'Træk en Kasse ind i Auto-kasser.' is still visible below the grid in the real editor. It must not be visible in normal editing."},
    "B": {"status": "PENDING", "evidence": [], "note": "Kasse/nesting: existing container/flex/grid and LayoutParentKey data must remain intact."},
    "C": {"status": "FAIL", "evidence": ["manual-2026-08-23-screenshot", "manual-v0851-known-good-observation"], "note": "FAIL: real palette Under still produces three 4/12 sibling columns instead of stacking the new Image/Text below the intended child. User reports the same interaction worked in v0.8.51, so v0.8.54 should restore that known-good drop/stack path rather than add a new placement model."},
    "D": {"status": "PENDING", "evidence": [], "note": "Resize: existing horizontal column resize and vertical 2D height resize must continue to work."},
    "E": {"status": "PENDING", "evidence": [], "note": "Responsive Desktop/Mobile values and inheritance must remain unchanged."},
    "F": {"status": "FAIL", "evidence": ["manual-2026-08-23-screenshot"], "note": "PARTIAL/FAIL: red selection marking now appears and selection no longer loops, but the right red edge is clipped/missing on the rightmost element. A complete four-sided frame is required."},
    "G": {"status": "PENDING", "evidence": [], "note": "Inspector/workspace: the v0.8.52 full-width Desktop/Mobile layout remains the approved design and must not regress."},
    "H": {"status": "PENDING", "evidence": [], "note": "Undo/Redo: nested drop/stack and other element changes must continue to produce correct history checkpoints."},
    "I": {"status": "PENDING", "evidence": [], "note": "Save/reload persistence: StackRootKey/height distribution and existing page/layout data must survive reload."},
    "J": {"status": "PENDING", "evidence": [], "note": "Unsaved preview Desktop/Tablet/Mobile must match frontend and contain no editor chrome."},
    "K": {"status": "PENDING", "evidence": [], "note": "Backup/restore sanity must remain unchanged."},
    "L": {"status": "PENDING", "evidence": [], "note": "Vehicle/Event/Gallery and already-designed pages must remain unchanged; public cutover is not authorized."}
  },
  "criticalFlags": {
    "consoleError": false,
    "dataLossOrDuplicate": false,
    "protectedDomainRegression": false
  },
  "overallStatus": "FAIL",
  "notes": "Manual v0.8.53 staging retest confirms three open regressions: visible legacy Auto-kasse placeholder, real palette Under not establishing the intended vertical stack, and right-edge clipping of the red selection frame. Selection/reconcile looping appears resolved. User additionally identified v0.8.51 as known-good for the nested Under behavior; v0.8.54 is therefore based on restoring the durable v0.8.51 drop intention path while preserving the approved v0.8.52 Inspector design. Public cutover remains unauthorized."
}
